"Title","Link","Metascore","ReleaseDate","Description","Developer","Publisher","Platforms","Genre"
"Final Fantasy VII","https://www.metacritic.com/game/final-fantasy-vii/","92",1997-09-07,"An evil and powerful corporation is slowly draining life from the planet in an effort to control the universe. However, a small rebellion, known as AVALANCHE, has vowed to put an end to this destructive plan.

You take on the role of Cloud Strife, an ex-soldier of the evil Shinra corporation, who joins AVALANCHE as a selfish mercenary, but becomes much more involved in this mysterious epic of friendship, love, and the battle between good and evil.","SquareSoft","SCEA","PC, PlayStation, PlayStation 4, iOS (iPhone/iPad), Nintendo Switch, Xbox One","JRPG"
"Chrono Trigger","https://www.metacritic.com/game/chrono-trigger/","92",2008-11-25,"[Metacritic's 2008 DS Game of the Year] When a newly developed teleportation device malfunctions at the Millennial Fair, young Crono must travel through time to rescue his unfortunate companion from an intricate web of past and present perils. The swashbuckling adventure that ensues soon unveils an evil force set to destroy the world, triggering Crono's race against time to change the course of history and bring about a brighter future. Features an engaging and unparalleled storyline, leading to the discovery of multiple epic conclusions to a journey that transcends time. An inspiring musical score created by Yasunori Mitsuda. Intriguing battle system made possible by the unique combination of the Active Time Battle system and Tech skills. Famed character designer Akira Toriyama lends his signature art style to create the vibrant world that has captivated gamers around the world. Taking advantage of the Nintendo DS hardware, CHRONO TRIGGER makes its way onto the portable platform with all-new dual screen presentation and Touch-Screen functionality. A brand new dungeon and a Wireless Play mode adds exciting new dimensions to this timeless classic. [Square Enix]","TOSE","Square Enix","PlayStation, DS, iOS (iPhone/iPad), PC","JRPG"
"Final Fantasy XIV: Endwalker","https://www.metacritic.com/game/final-fantasy-xiv-endwalker/","92",2021-12-07,"Endwalker is the fourth expansion pack for FINAL FANTASY XIV Online. Experience the climax of the Hydaelyn and Zodiark story, and encounter an even greater calamity than ever before as you travel to the far reaches of Hydaelyn and even to the moon.","Creative Business Unit III","Square Enix","PC, PlayStation 4, PlayStation 5","MMORPG"
"Journey","https://www.metacritic.com/game/journey/","92",2012-03-13,"Enter the world of Journey, the third game from indie developers thatgamecompany (creators of ""flOw"" and ""Flower""). Journey is an interactive parable, an anonymous online adventure to experience a person’s life passage and their intersections with other’s. You wake alone and surrounded by miles of burning, sprawling desert, and soon discover the looming mountaintop which is your goal. Faced with rolling sand dunes, age-old ruins, caves and howling winds, your passage will not be an easy one. The goal is to get to the mountaintop, but the experience is discovering who you are, what this place is, and what is your purpose. Travel and explore this ancient, mysterious world alone, or with a stranger you meet along the way. Soar above ruins and glide across sands as you discover the secrets of a forgotten civilization. [thatgamecompany]","ThatGameCompany","SCEA","PlayStation 3, PlayStation 4, PC, iOS (iPhone/iPad)","3D Platformer"
"Medal of Honor (1999)","https://www.metacritic.com/game/medal-of-honor-1999/","92",1999-10-31,"Tomorrow is D-Day. Tonight you land behind enemy lines. The tide of the way is in your hands. You are an elite Special Forces agent sent to execute covert operations, search and rescue missions, and commando raids. Fight to win the medal of Honor in the only game that lets you take on Nazis in WWII.","Dreamworks Interactive","Electronic Arts","PlayStation","FPS"
"Conker's Bad Fur Day","https://www.metacritic.com/game/conkers-bad-fur-day/","92",2001-03-04,"The day after his 21st birthday bash, Conker's sporting the worst hangover ever, and he just can't seem to find his way home. Prepare to stagger through randy, raunchy, raucous scenarios crammed full of bad manners, twisted humor, and graphic bodily functions. Unless you're a fan of violence, foul language, and racy innuendo, you'd best steer clear of this one.","Rare Ltd.","Rare Ltd.","Nintendo 64","3D Platformer"
"Rock Band 2","https://www.metacritic.com/game/rock-band-2/","92",2008-09-14,"Rock Band 2 builds upon its foundation as the first music game to introduce co-operative band gameplay, multiple instruments, a robust online multiplayer experience, an unrivaled offering of downloadable content and raises the bar by delivering an entirely new level of depth, connectivity, authenticity and features including: Backwards compatibility with Rock Band downloadable music content. All previously purchased tracks immediately load into your Rock Band 2 song list. No need to re-purchase or re-download. The biggest and most diverse soundtrack ever featuring some of rock's most prolific acts, comprised entirely of master recordings. Major new and dynamic online modes that connect the entire Rock Band community in more ways than ever before both locally and globally. More variety of instrument choices than ever before with new and improved drum and guitar peripherals, enhanced functionality and innovative new designs - all fully compatible with the original Rock Band instruments. [MTV]","Harmonix Music Systems","MTV Games","Xbox 360, PlayStation 3, Wii, PlayStation 2","Rhythm"
"Mario Kart 8 Deluxe","https://www.metacritic.com/game/mario-kart-8-deluxe/","92",2017-04-28,"Race and battle your friends in the definitive version of Mario Kart 8. Hit the road with the definitive version of Mario Kart 8 and play anytime, anywhere! Race your friends or battle them in a revised battle mode on new and returning battle courses. Play locally in up to 4-player multiplayer in 1080p while playing in TV Mode. Every track from the Wii U version, including DLC, makes a glorious return. Plus, the Inklings appear as all-new guest characters, along with returning favorites, such as King Boo, Dry Bones, and Bowser Jr. Race your friends in the definitive version of Mario Kart 8, only on Nintendo Switch. Race as every character on every track from the Wii U version, including DLC characters and tracks. Pop some balloons in the revamped Battle mode, complete with Balloon Battle and Bob-omb Blast. Battle on new courses, like Urchin Underpass and Battle Stadium, or returning ones, such as GCN Luigi's Mansion and SNES Battle Course 1. Inkling Girl & Inkling Boy from Splatoon, King Boo, Dry Bones, and Bowser Jr. join the roster. Players can choose a new Smart Steering feature which makes driving and staying on the track easy for novice players and kids even at 200cc. Three new vehicles have been added, two are even inspired by Splatoon. Carry two items at the same time. Returning items include Boo, the item stealing ghost, and the Feather, which gives you a high jump in battle mode. Play your friends in local wireless multiplayer with up to 8 players. Drive through in 1080p HD quality in TV mode. Play on the go with handheld mode and play anytime, anywhere.","Nintendo","Nintendo","Nintendo Switch","Auto Racing"
"The ICO & Shadow of the Colossus Collection","https://www.metacritic.com/game/the-ico-and-shadow-of-the-colossus-collection/","92",2011-09-27,"This collection provides HD and 3D updates for PS2 classics Ico and Shadow of the Colossus.","Bluepoint Games","SCEA","PlayStation 3","Compilation"
"Metroid Prime 2: Echoes","https://www.metacritic.com/game/metroid-prime-2-echoes/","92",2004-11-15,"The sequel to Metroid Prime puts you in the role of bounty hunter Samus Aran once again. Your mission is to locate federation troopers who are missing on Aether--a planet torn into light and dark domains. To help you travel through the depths of light and dark, you'll have all-new beam weapons, a screw attack, and power-ups. Eliminate your enemies, solve puzzles, and open doors in an effort to restore peace to Aether. Metroid Prime 2: Echoes also features competitive multiplayer modes supporting up to four players.","Retro Studios","Nintendo","GameCube, Wii","FPS"
"Out of the Park Baseball 17","https://www.metacritic.com/game/out-of-the-park-baseball-17/","92",2016-03-22,"Step into the shoes of a team owner, GM, and/or field manager to own the future or rewrite the past of your favorite real-world club. Start a new career with 2016 Opening Day rosters of the real major or minor leagues, or span through 150 years of history and run any club from the past! Perform drafts, trades, scouting, waivers, team finances and personnel. Negotiate player contracts. Dive into the more hands-on management and set your team's lineups, pitching staffs, and in-game strategy. You can oversee your league at a high level, or play out each game, managing play by play or even pitch by pitch!","Out Of The Park Developments","Out Of The Park Developments","PC","Baseball Sim"
"Metroid Fusion","https://www.metacritic.com/game/metroid-fusion/","92",2002-11-17,"While lending mission support on planet SR388, interstellar bounty hunter Samus Aran is attacked by an X parasite, an organism with the ability to mimic the abilities of any creature it infects. Near death, Samus is saved by a vaccine made from the DNA of the last Metroid--the X parasite's only natural predator. When the X spread to a research station in orbit around SR388, a weakened Samus is forced to exterminate them all...or die trying.","Nintendo","Nintendo","Game Boy Advance","Metroidvania"
"The Witcher 3: Wild Hunt - Blood and Wine","https://www.metacritic.com/game/the-witcher-3-wild-hunt-blood-and-wine/","92",2016-05-30,"This expansion pack is an old-school add on with 20 hours of new adventures, where players will travel to the land of Toussaint.","CD Projekt Red Studio","CD Projekt","PC, PlayStation 4, Xbox One","Action RPG"
"Final Fantasy VI","https://www.metacritic.com/game/final-fantasy-vi/","92",2007-02-05,"Learn From The Past. Many centuries have passed since the war of the Magi - civilisations have been rebuilt with iron, machines and technology. But the forces of magic have begun to return, and when an ancient Esper is discovered, the risk of war resurfaces. Featuring all-new CG cinematic sequences exclusive to this edition. Discover the origins of special featurs later developed in the subsequent FINAL FANTASY series, including summoning magic, mini quests, the Active Time Battle system and much more Numerous weapons, items, magic spells and special skills allow for incredible gameplay depth and strategy","TOSE","Nintendo","PlayStation, iOS (iPhone/iPad), PC, Game Boy Advance","JRPG"
"Rayman Legends","https://www.metacritic.com/game/rayman-legends/","92",2013-09-03,"Rayman, Globox, and the Teensies are off wandering through an enchanted forest when they discover a mysterious tent filled with a series of captivating paintings. As they look more closely, they notice each painting seems to tell the story of a mythical world. While focusing on a painting that shows a medieval land, they are suddenly sucked into the painting, entering the world, and the adventure begins. The gang must run, jump and fight their way through each world to save the day and discover the secrets of every legendary painting. Rayman Legends takes full advantage of the Wii U and its new GamePad’s capabilities. Use the touch screen to take out enemies, manipulate platforms, cut ropes to clear a path and much more. With the gyroscope technology, you can move rotating platform and there are many more surprises to come.","Ubisoft Montpellier","Ubisoft","Wii U, PlayStation Vita, PlayStation 3, Xbox 360, PC, PlayStation 4, Xbox One","2D Platformer"
"UFO 50","https://www.metacritic.com/game/ufo-50/","91",2024-09-18,"UFO 50 is a collection of 50 single and multiplayer games from the creators of Spelunky, Downwell, and Catacomb Kids. Explore a variety of genres, from platformers and shoot 'em ups to puzzle games, roguelites, and RPGs. Our goal is to combine a familiar 8-bit aesthetic with new ideas and modern game design.","Mossmouth","Mossmouth","PC","Party"
"Madden NFL 2005","https://www.metacritic.com/game/madden-nfl-2005/","91",2004-08-09,"Madden NFL 2005 introduces the Hit Stick, a new feature that lets players turn a game around with a crucial tackle. Along with all-new defensive preplay controls and defensive artificial intelligence enhancements, the defense now has a diverse arsenal of weapons available. Also, the depth of Franchise mode grows with the addition of Storyline Central, a weekly radio talk show that discusses current stories regarding your team and the league. With even more Franchise mode additions, hundreds of new animations, and the new Create-a-Fan feature, Madden NFL 2005 takes the series to the next level.","EA Tiburon","EA Sports","PC, Xbox, GameCube, PlayStation 2, Game Boy Advance, PlayStation, DS","Football Sim"
"Against the Storm","https://www.metacritic.com/game/against-the-storm/","91",2023-12-08,"Banished meets Slay the Spire.

Against the Storm is a roguelite city builder set in a fantasy world where it never stops raining. You are the Queen's viceroy - a pioneer sent into the wilds to establish and manage new settlements inhabited by beavers, lizards, and humans.

Your goal is to survive long enough and gather the valuable resources necessary to rebuild and upgrade the Smouldering City. It's the only safe haven against the Blightstorm - a vile cycle of destruction ravaging everything in its path. Do you have what it takes to weather the storm?","Eremite Games","Hooded Horse","PC, PlayStation 5, Nintendo Switch, Xbox Series X, Xbox One, PlayStation 4","Management"
"Medal of Honor: Allied Assault","https://www.metacritic.com/game/medal-of-honor-allied-assault/","91",2002-01-20,"As Lt. Mike Powell, member of the famed 1st Ranger Battalion, you'll battle through over 20 levels based on historical military campaigns of World War II. Fire period weapons and command authentic war vehicles as you silence the gun batteries at Port Arzew, survive the Omaha Beach landing, and more. [Electronic Arts]","2015","Electronic Arts","PC","FPS"
"Myth: The Fallen Lords","https://www.metacritic.com/game/myth-the-fallen-lords/","91",1997-10-31,"Myth is arguably the first real-time strategy game to put the player in a true 3D landscape, with an emphasis on tactical battlefield action rather than base construction. Myth also happens to be one of Bungie's most successful pre-Halo releases, and shows off the company's range and ability in genres outside of first-person shooters. A single player mode features an engrossing and enjoyable plot, with you battling the evil and eponymous Fallen Lords, their evil leader, Balor and all manner of undead creatures, but Myth's multiplayer is where it really stands out. Bungie.net's game-matching technology has been much-emulated since, and at Myth's release, was something truly special. Multiple game modes including King of the Hill, Steal the Bacon and even co-op added huge variety to what was an outstanding and standard-setting game - and it still is. If ever an older game deserved another visit, it's Myth, with a huge, loyal and highly motivated following. [Bungie]","Bungie","Bungie","PC","Real-Time Strategy"
"LittleBigPlanet 2","https://www.metacritic.com/game/littlebigplanet-2/","91",2011-01-18,"Media Molecule and Sony Europe are already working on a follow-up to their critically acclaimed platformer.","Media Molecule","SCEA","PlayStation 3","2D Platformer"
"Microsoft Flight Simulator","https://www.metacritic.com/game/microsoft-flight-simulator/","91",2020-08-18,"From light planes to wide-body jets, fly highly detailed and accurate aircraft in the next generation of Microsoft Flight Simulator. Test your piloting skills against the challenges of night flying, real-time atmospheric simulation and live weather in a dynamic and living world.","Asobo Studio","Xbox Game Studios","Xbox Series X, PC","Aircraft Sim"
"Slay The Princess - The Pristine Cut","https://www.metacritic.com/game/slay-the-princess-the-pristine-cut/","91",2024-10-24,"You're on a path in the woods, and at the end of that path is a cabin. And in the basement of that cabin is a Princess.

You're here to slay her. If you don't, it will be the end of the world.

She will do everything in her power to stop you. She'll charm, and she'll lie, and she'll promise you the world, and if you let her, she'll kill you a dozen times over. You can't let that happen.

You do care about the fate of the world, right?

Slay the Princess - The Pristine Cut is a fully voice-acted horror tragicomedy featuring the impeccable talents of Jonathan Sims and Nichole Goodnight, with lovingly hand-penciled frames by Ignatz-winning graphic novelist Abby Howard.

This game features a princess. She's very bad and you have to get rid of her for all our sakes. She's just an ordinary human Princess, and you can definitely slay her as long as you put your mind to it. Hopefully you won't die. But if you do, you'll die a lot. Be careful and stay focused on the task at hand! What you say and what you believe will shift the story in dramatic ways.

Ah, but what’s in the Pristine Cut? Are you sure you want to find out? If you do, you’re likely to discover things that are best left experienced directly. Seriously, turn back.

…

Oh, you’re still reading? Very well, I shall tell you. The Pristine Cut contains, precisely:

- 3 brand new chapters replete with mysteries—and consequences.
- Never before seen Princesses who will all murder you without a second thought.
- Expansions to familiar routes: The Den, The Apotheosis and The Fury each have more than doubled in length.
- Over 35% more content overall—and all of it filled with great opportunities to listen to me and do your job.
- A new ending. And hopefully one that saves the world rather than damns it.
- Gallery to Track Your Progress: Cherish your memories, relive your exploits, and uncover deeply hidden secrets with the new gallery feature.
- Over 1,200 New Hand-Penciled Frames hand-illustrated by Abby Howard.
- Over 2,500 New Lines of Dialogue fully voiced dialogue by the impeccable Jonathan Sims and Nichole Goodnight.","Black Tabby Games","Serenity Forge","Nintendo Switch, PlayStation 5, Xbox Series X, PC, Xbox One, PlayStation 4","Visual Novel"
"Guitar Hero","https://www.metacritic.com/game/guitar-hero/","91",2005-11-07,"Strap on your Guitar Hero SG controller, plug-in, and CRANK IT UP. Guitar Hero creates all the sensations of being a rock star, as you rock out to 30 of the greatest rock anthems of all time and more. Soundtrack includes songs as made famous by such legendary artists as the Red Hot Chili Peppers, David Bowie, Boston, Sum 41, Ozzy Osbourne, Audioslave, White Zombie, Franz Ferdinand, and The Ramones. So kiss that air guitar goodbye and get ready to rock. Features over 30 of the greatest rock songs of all-time. 4 difficulty levels (Easy, Medium, Hard, and Expert). 6 venues that range from basement parties to sold out stadiums. 8 different characters that each offer their own look and unique style of playing, from metal head to classic rocker. Two-player mode that offers tons of multiplayer fun. [Red Octane]","Harmonix Music Systems","RedOctane","PlayStation 2","Rhythm"
"World of Warcraft: Wrath of the Lich King","https://www.metacritic.com/game/world-of-warcraft-wrath-of-the-lich-king/","91",2008-11-13,"Players last visited Northrend in ""Warcraft III: The Frozen Throne,"" when Arthas Menethil fused with the spirit of Ner’zhul to become the Lich King, one of the most powerful beings in the Warcraft universe. He now broods atop the Frozen Throne deep in Icecrown Citadel, clutching the rune blade Frostmourne and marshaling the undead armies of the Scourge. In Wrath of the Lich King, the forces of the Alliance and the Horde venture into battle against the Scourge amid Northrend’s howling winds and fields of jagged ice. Wrath of the Lich King adds a rich variety of content to an already massive game. New features in the game’s second expansion include: Death Knight Hero Class: Create a high-level Death Knight character -- the game’s first hero class -- once certain challenges have been met. Increased Level Cap: Advance to level 80 and gain potent new talents and abilities along the way. Northrend: Explore the harsh new continent of Northrend, packed with new zones, quests, dungeons, monsters, and items -- and do battle with the undead armies of the Lich King. ""Inscription"" Profession: Learn this exciting new profession and gain unique ways to permanently enhance spells and abilities in the game. Siege Weapons and Destructible Buildings: Take the battle to another level with new player-vs.-player game mechanics and new battlefields to wage war on. New Character Customization: Change how characters look and express themselves, with different hairstyles and dance animations. [Blizzard Entertainment]","Blizzard Entertainment","Blizzard Entertainment","PC","MMORPG"
"Metroid Prime Trilogy","https://www.metacritic.com/game/metroid-prime-trilogy/","91",2009-08-24,"Metroid Prime 3: Corruption set a new standard for first-person motion controls in video games. Now it’s bringing those controls to the rest of the celebrated series, allowing players to experience the entire Metroid Prime story arc with the precision of the Wii Remote. Metroid Prime Trilogy, is a three-game collection for the Wii console that bundles all three landmark Metroid Prime games onto one disc and revamps the first two installments with intuitive Wii Remote controls, wide-screen presentation and other enhancements. Each game maintains its original storyline and settings, but now Metroid Prime and Metroid Prime 2: Echoes let players use their Wii Remote to aim with precision as heroine Samus Aran. Based on the breakthrough control system that debuted in Metroid Prime 3: Corruption, these new Wii controls bring an entirely new level of immersion and freedom to these milestone games. Players can access the game they want from a unified main menu that ties together all three adventures. Through a new unlockables system, players can gain access to in-game rewards such as music and artwork by accomplishing objectives across all three games. [Nintendo]","Retro Studios","Nintendo","Wii","Compilation"
"I Was a Teenage Exocolonist","https://www.metacritic.com/game/i-was-a-teenage-exocolonist/","91",2022-08-25,"Spend your teenage years on an alien planet in this narrative RPG with card-based battles. Explore, grow up, and fall in love. The choices you make and skills you master over ten years will determine the course of your life and the survival of your colony.","Northway Games","Finji","PC, PlayStation 4, PlayStation 5, Nintendo Switch","Card Battle"
"Baldur's Gate","https://www.metacritic.com/game/baldurs-gate/","91",1998-12-21,"Baldur's Gate takes you back to the Forgotten Realms on a visually dazzling role-playing adventure, one that brings to life the grand tradition of Advanced Dungeons & Dragons through cutting edge art and technology. Immerse yourself in this quintessential medieval fantasy world, where entire nations hang in the balance of your actions, dark prophecies test your resolve, and heroic dreams can be fulfilled at last. [Interplay]","BioWare","Interplay","PC, Dreamcast, PlayStation","Western RPG"
"Madden NFL 2001","https://www.metacritic.com/game/madden-nfl-2001/","91",2000-10-23,"EA Sports steps up to the challenge of Sega's ""NFL2k1"" with mind-blowing graphics and innovative ""Madden Cards"" -- Upper Deck creations purchased with tokens earned by completing in-game challenges which can be used as power-ups during the game.  Match up all current NFL teams as well as great teams from the past in Season, Franchise, or Practice modes.","EA Sports","EA Sports","PlayStation 2, PlayStation, Nintendo 64, PC","Football Sim"
"F1 Challenge '99-'02","https://www.metacritic.com/game/f1-challenge-99-02/","91",2003-06-24,"Cutting-edge technology brings you the most accurate representation of Formula One to date. High-resolution car models include details right down to the very last shut line. Circuits include real life structures, helicopters, airplanes, panoramic skies, animated grid girls, motion captured pit crews, and even bumps in the track surface as they exist in reality. The glossy team-themed user interface puts you in the game and tracks your performance as a real life driver competing against the likes of world champion drives such as Damon Hill, Jacques Villeneuve, Mika Hakkinen, and Michael Schumacher. [Electronic Arts]","Electronic Arts","Electronic Arts","PC","Auto Racing Sim"
"Overwatch","https://www.metacritic.com/game/overwatch/","91",2016-05-23,"Overwatch is a highly stylized team-based shooter set on earth in the near future. Every match is an intense multiplayer showdown pitting a diverse cast of soldiers, mercenaries, scientists, adventurers, and oddities against each other in an epic, globe-spanning conflict.","Blizzard Entertainment","Blizzard Entertainment","PC, PlayStation 4, Xbox One, Nintendo Switch","Tactical FPS"
