"Title","Link","Metascore","ReleaseDate","Description","Developer","Publisher","Platforms","Genre"
"World of Warcraft: Cataclysm","https://www.metacritic.com/game/world-of-warcraft-cataclysm/","90",2010-12-07,"In Cataclysm, players witness the face of Azeroth being altered forever, as the corrupted Dragon Aspect Deathwing awakens from his subterranean slumber and erupts onto the surface, leaving ruin and destruction in his wake. As the Horde and Alliance race to the epicenter of the cataclysm, the kingdoms of Azeroth will witness seismic shifts in power, the kindling of a war of the elements, and the emergence of unlikely heroes who will rise up to protect their scarred and broken world from utter devastation. New features in the game's third expansion include: Two New Playable Races: Adventure as the cursed worgen with the Alliance or the resourceful goblins with the Horde. Increased Level Cap: Advance to level 85 and earn new abilities, tap into new talents, and progress through the path system, a new way for players to customize characters. Classic Zones Remade: Quest to level 60 as you never have before. Familiar zones across the original continents of Kalimdor and the Eastern Kingdoms have been reforged by the cataclysm and updated with new quests and content. Flying Mounts in Azeroth: Explore Kalimdor and the Eastern Kingdoms from a whole new perspective. Guild Advancement: Progress as a guild to earn guild levels and guild achievements. New High-Level Content: Explore newly opened parts of the world, including Uldum, Grim Batol, and the great sunken city of Vashj'ir beneath the sea, and enjoy even more high-level raid content than in previous expansions. New PvP Zone & Rated Battlegrounds: Take on PvP objectives and daily quests on Tol Barad Island, a new Wintergrasp-like zone, and wage war in all-new rated Battlegrounds. Archaeology: Master a new secondary profession to unearth valuable artifacts and earn unique rewards. New Race and Class Combinations: Explore Azeroth as a gnome priest, blood elf warrior, or one of the other never-before-available race and class combinations. [Blizzard Entertainment]","Blizzard Entertainment","Blizzard Entertainment","PC","MMORPG"
"Bayonetta","https://www.metacritic.com/game/bayonetta/","90",2010-01-05,"Bayonetta is a stylish and cinematic action game directed by creator Hideki Kamiya. A member of an ancient witch clan and possessing powers beyond the comprehension of mere mortals, Bayonetta faces-off against countless ethereal enemies, many reaching epic proportions, in a game of 100% pure, unadulterated all-out action. Outlandish finishing moves are performed with balletic grace as Bayonetta flows from one fight to another. With over-the-top action taking place in stages that are a veritable theme park of exciting attractions, Bayonetta pushes the limits of the action genre, bringing to life its fast-paced, dynamic climax combat. [Sega]","PlatinumGames","Sega","PlayStation 3, Xbox 360, Wii U, PC, Nintendo Switch, PlayStation 4, Xbox One","Linear Action Adventure"
"Diablo III: Ultimate Evil Edition","https://www.metacritic.com/game/diablo-iii-ultimate-evil-edition/","90",2014-08-19,"PlayStation 4 players can now experience the full adventure of Blizzard’s epic action RPG, Diablo III, and the upcoming expansion, Reaper of Souls all from the comfort of their couch in Diablo III: Ultimate Evil Edition! Take on the role of one of six powerful character class Barbarian, Demon Hunter, Monk, Witch Doctor, Wizard, or the all-new Crusader and embark on a dark journey through Acts I-V to save the world of Sanctuary from ancient and sinister forces. With the new DUALSHOCK 4 wireless controller and a custom-designed console interface, players will be outfitted with touch pad functionality and new social features as they engage in pulse-pounding combat with hordes of monsters and acquire items of incredible power.","Blizzard Entertainment","Blizzard Entertainment","PC, PlayStation 4, PlayStation 3, Xbox One, Xbox 360","Action RPG"
"ICO","https://www.metacritic.com/game/ico/","90",2001-09-24,"Assume the role of Ico, a courageous young boy born with horns who has been delivered to a mysterious castle to be sacrificed so that, according to legend, the community will be saved.  Attempt to escape the grounds and save a princess through a variety of mazes, brainteasers, and other puzzles.","SCE Japan Studio","SCEA","PlayStation 2, PlayStation 3","Linear Action Adventure"
"Tom Clancy's Ghost Recon Advanced Warfighter","https://www.metacritic.com/game/tom-clancys-ghost-recon-advanced-warfighter/","90",2006-03-09,"In 2013, the U.S. Army will implement the Integrated Warfighter System (IWS), evolving what we know as the modern soldier. IWS combines advanced weapon systems, satellite communication devices and enhanced survivability into one fully integrated combat system. The IWS program has been developed to meet these new threats head on. Now, it can be tested on the battlefield. Following an insurgence in the heart of Mexico City, the U.S. Army's most elite Special Forces team is deployed to the center of the conflict to regain control of the city. Greatly outnumbered but fully equipped with the IWS, this elite team is the first and last line of defense on the battlefield. They are the ""Quiet"" professionals. They are the Ghosts. Gain access to the future of military technology. Using a fully integrated combat system with cutting-edge weapons and revolutionary communication systems, gamers embody the soldier of the future. Based on actual U.S. Army research, the Ghosts give gamers a realistic view of how war will be fought in the next decade. Use the revolutionary Cross-Com, a communication device powered by satellite technology. Attached to the soldier's monocle, the Cross-Com provides full situational awareness and command of the battlefield. Command the Ghost squad and remote allied forces and drones, and direct artillery and air strikes. See what the squad sees and receive visual and auditory intel from allied forces and unmanned drones. [Ubisoft]","Ubisoft Paris","Ubisoft","GameCube, PC, Xbox, PlayStation 2, Xbox 360","Tactical FPS"
"World of Goo","https://www.metacritic.com/game/world-of-goo/","90",2008-10-12,"World of Goo is a physics based puzzle / construction game. The millions of Goo Balls that live in the beautiful World of Goo don't know that they are in a game, or that they are extremely delicious. [2D Boy]","2D Boy","2D Boy","Wii, PC, iOS (iPhone/iPad), Nintendo Switch","Action Puzzle"
"Mario & Luigi: Superstar Saga","https://www.metacritic.com/game/mario-and-luigi-superstar-saga/","90",2003-11-17,"An evil witch has replaced Princess Peach's fair speech with explosives!  Mario and Luigi must once again come to her rescue, but this time they employ the help of Bowser, their sworn enemy.  Mario and Luigi must learn new moves and combine powers to fight off enemies and move closer to the witch's castle.  Guide this unlikely bunch through an abundance of minigames such as Border Jump and Mystery Carts.  Combine the powers of Mario and Luigi to pull off special tag-team moves. Immerse yourself in this bright, cartoonish, and humorous world, complete with hit music featured in previous Mario games.","Alphadream Corporation","Nintendo","Game Boy Advance","JRPG"
"Slay the Princess","https://www.metacritic.com/game/slay-the-princess/","90",2023-10-23,"You're here to slay the princess. Don't believe her lies.","Black Tabby Games","Black Tabby Games","PC","Visual Novel"
"Tony Hawk's Underground","https://www.metacritic.com/game/tony-hawks-underground/","90",2003-10-27,"Get ready for a totally new breed of the Tony Hawk experience. Play as yourself, not a pro skater, and make your way through a plot-twisting, true-to-life story that takes you from unknown local skate punk to fame and fortune as a superstar skater. For the first time ever, you'll be able to get off your board and explore 9 expansive levels on foot or by vehicle. Enjoy unprecedented customization by designing and naming your own original tricks through the all-new Create-a-Trick. Or create bigger parks and include your own goals in the expanded Skate Park Editor. After you're done, share your tricks and parks online with your friends. You can even download your own face into the game! And, with all-new online play - new games, stats, and online rankings - you'll have infinite expansion through downloadable content. You're the star...you own the Underground! [Activision]","Neversoft Entertainment","Activision","PlayStation 2, Xbox, GameCube, Game Boy Advance, PC","Skating"
"Syphon Filter","https://www.metacritic.com/game/syphon-filter/","90",1999-02-17,"While it may not be an original concept, the game is truly greater than the sum of its many parts.","Eidetic","989 Studios","PlayStation, PlayStation 4, PlayStation 5","Third Person Shooter"
"Ape Escape","https://www.metacritic.com/game/ape-escape/","90",1999-06-23,"A boisterous band of baboons carry out a daring zoo escape. It's ape anarchy and it's up to you to stop the chimps before they make chumps out of the human race! Use both analog sticks to operate great gadgets including a Tank, a Remote Control Car, a Stun Club, and a Time Net in your quest to hunt down over 200 apes!","SCE Japan Studio","SCEA","PlayStation, PlayStation 4, PlayStation 5","3D Platformer"
"Mario & Luigi: Bowser's Inside Story","https://www.metacritic.com/game/mario-and-luigi-bowsers-inside-story/","90",2009-09-14,"In his evil plot to take over the Mushroom Kingdom, Fawful tricks Bowser into eating a magic mushroom. The mushroom causes Bowser to begin inhaling everything around him, including Mario, Luigi and Princess Peach! Do the Mario Bros. have the guts to rescue Peach and escape? Players are in control of two separate storylines. One features Bowser and his efforts to stop an arch-villain from taking over his castle. Meanwhile, inside Bowser, the microbe-sized Mario & Luigi must muscle their way through challenges and keep their nerve if they want to find a way out. They take action to control Bowser from the inside - but without his knowledge. Players can switch between storylines at will. What happens inside Bowser affects what he’s doing on the outside. Sometimes Mario & Luigi must solve puzzles and challenges behind the scenes to help Bowser overcome various obstacles and advance the plot. Players must make well-timed button presses to enhance their performance during battles and challenges. In some battles, Bowser grows so large that players must turn their Nintendo DS or Nintendo DSi system sideways, blow into the microphone or tap on the touch screen with the stylus to keep up with the action. The game features the same hilarious dialogue that has been the hallmark of the Mario & Luigi series. [Nintendo]","Alphadream Corporation","Nintendo","DS","JRPG"
"Trials Evolution","https://www.metacritic.com/game/trials-evolution/","90",2012-04-18,"The follow-up to Trials HD brings the bike-racing action back to the Xbox 360. Ride in real-time multiplayer with two to four players, either locally or through XBLA. Take part in single player career with 50 tracks, challenging unlocks, and tricky achievements. A massive, track editor lets you build the track of your choosing and share it with the world. Or simply download highly-rated tracks from around the globe using Track Central.","RedLynx, Ubisoft","Microsoft Game Studios","Xbox 360, PC","Auto Racing Sim"
"Grand Theft Auto IV: The Lost and Damned","https://www.metacritic.com/game/grand-theft-auto-iv-the-lost-and-damned/","90",2009-02-17,"[Xbox Live Arcade]  Johnny is a veteran member of The Lost, a notorious biker gang. Johnny has been creating business opportunities for The Lost in Liberty City, but his first loyalty must be to the patch he wears on his back and to Billy Grey, the club's President. However, when Billy returns from rehab hell-bent on bloodshed and debauchery, Johnny finds himself in the middle of a vicious turf war with rival gangs for control of a city torn apart by violence and corruption. Can the brotherhood survive? Developed by series creator Rockstar North and set in Liberty City, Grand Theft Auto IV: The Lost and Damned features a new main character, Johnny Klebitz, and plot that intersects with the storyline of Grand Theft Auto IV; new missions that offer an entirely fresh way to explore Liberty City with new multiplayer modes, weapons and vehicles; and a diverse soundtrack with additional music - all with the incredible production values that are the trademarks of Grand Theft Auto. All-new missions and a new storyline that interweaves with the original story arc of Grand Theft Auto IV. Play as Johnny, a member of The Lost Motorcycle Club. Experience Liberty City now with the perspective and lifestyle of a member of a biker gang. Added range of weapons - including the all-new grenade launcher and sawed-off shotgun. New weapons will be available for use in single-player and in all new multiplayer modes. New vehicles - featuring a collection of bikes that include Johnny's own customized heavy-duty chopper. New and improved bike handling and physics. Set of new action-packed multiplayer modes - details coming soon. All-new in-game TV, internet and radio content featuring new radio shows and original music. Plus new side-missions and Xbox 360 Achievement. [Rockstar Games]","Rockstar North","Rockstar Games","Xbox 360, PlayStation 3, PC","Open-World Action"
"FIFA Soccer 12","https://www.metacritic.com/game/fifa-soccer-12/","90",2011-09-27,"FIFA Soccer 12 brings a new physics engine into the soccer gameplay.","Electronic Arts","Electronic Arts","iOS (iPhone/iPad), 3DS, Xbox 360, PlayStation 3, PlayStation 2, PSP, PC, Wii","Soccer Sim"
"Factorio","https://www.metacritic.com/game/factorio/","90",2020-08-14,"Factorio is a game about building and creating automated factories to produce items of increasing complexity, within an infinite 2D world. Use your imagination to design your factory, combine simple elements into ingenious structures, and finally protect it from the creatures who don't really like you.","Wube Software LTD.","Wube Software LTD.","PC, Nintendo Switch","Tycoon"
"Black & White","https://www.metacritic.com/game/black-and-white/","90",2001-03-26,"Peter Molyneux's highly anticipated ""god game,"" a blend of the genres including strategy, sim, RPG, and puzzle, features the player as a new god in the lands of Eden who must reign with the help of uniquely evolving animals in either a benign or evil fashion.","Lionhead Studios","EA Games","PC, Dreamcast, PlayStation","Real-Time Strategy"
"FIFA Soccer 10","https://www.metacritic.com/game/fifa-soccer-10/","90",2009-10-20,"On the pitch, critical gameplay fundamentals have been enhanced to ensure that FIFA Soccer 10 mirrors real-world soccer, providing more sophisticated ball control, and physical interaction between players. In addition, players now move, behave and position themselves more realistically. On attack, players analyze space more effectively, curve their runs in an attempt to stay onside, create passing lanes naturally, and drive for more variety in attacking options. On defense, new concepts like position priority enable defenders to multitask so dangerous spaces left open by teammates out of position are covered. Plus, slide tackle targeting, press marking, and better-urgency clearance logic provide new options that make defending a tactical skill in FIFA Soccer 10. In goal, a myriad of improvements and refinements to goalkeeper intelligence result in a more responsive and powerful rushing system and ultra-realistic saves. Better balance on lofted through balls, improved goalkeeper intelligence, more realistic shooting mechanics with less shots hitting the goal posts, a practice arena to perfect skills, and a more immersive soccer experience through continuous play and quick free kicks are just a few of the issues raised by fans and addressed in FIFA Soccer 10. Three new innovations revealed today at E3 have been developed to change the player control experience in FIFA Soccer 10. The first-ever true 360 degree dribbling system gives players finer control of the ball, enabling them to find spaces between defenders that previously were not possible. Using an all-new animation technology, skilled dribblers now have the ability to face the defender and use highly responsive lateral dribbling to skip past him. An innovative concept called Freedom in Physical Play enables players to perform wider dribble touches and new collision sharing creates a varied, less predictable, and extended fight for possession between the dribbler and a defender.
FIFA Soccer 10 also features a deeper iteration of the ever-popular Manager Mode with more than 50 major improvements, including new match realism, realistic player transfers based on multiple decision points, and true-to-life player growth curves. [Electronic Arts]","EA Sports","Electronic Arts","iOS (iPhone/iPad), PlayStation 3, Xbox 360, PC, DS, PSP, Wii, PlayStation 2","Soccer Sim"
"NBA Street Vol. 2","https://www.metacritic.com/game/nba-street-vol-2/","90",2003-04-28,"25 NBA legends scrap, battle and brawl for ultimate bragging rights. Play as Dr. J, Bird, Wilt, Moses, and more! Seven authentic urban courts including Soul in the Hole in NYC, Mosswood in Oakland, and more. All-new electrifying moves, passes and alley-oops. Play against the CPU or with up to four ballers. Customize the rules and players to your liking. [Electronic Arts]","Electronic Arts","EA Sports Big","Xbox, GameCube, PlayStation 2","Basketball"
"Ratchet & Clank: Going Commando","https://www.metacritic.com/game/ratchet-and-clank-going-commando/","90",2003-11-11,"From the creators of the critically acclaimed smash hit Ratchet & Clank, Insomniac Games, comes the next installment of the most exciting sci-fi action adventure ever. Ratchet & Clank: Going Commando features an enhanced health damage system and weapons upgrade system, beautiful diverse environments, a compelling storyline and a unique arsenal of the coolest new weapons and hi-tech gadgets ever imagined. The more $#@& you blow up, the stronger Ratchet gets and the bigger and badder the weapons you?ll have! Show off in gladiator arenas. Pick off enemies in space combat. Leave competitors to eatin? your dust in hoverbike races. And, run around spherical worlds. [SCEA]","Insomniac Games","SCEA","PlayStation Vita, PlayStation 2, PlayStation 3","3D Platformer"
"Marvel's Spider-Man 2","https://www.metacritic.com/game/marvels-spider-man-2/","90",2023-10-20,"Spider-Men, Peter Parker and Miles Morales, return for an exciting new adventure in Marvel’s Spider-Man franchise for PS5. Swing, jump and utilize the new Web Wings to travel across Marvel’s New York, quickly switching between Peter Parker and Miles Morales to experience different stories and epic new powers, as the iconic villain Venom threatens to destroy their lives, their city and the ones they love. The incredible power of the symbiote forces Peter and Miles to face the ultimate test of strength, both inside and outside the mask, as they balance their lives, friendships and their duty to protect those in need. Quickly swap between both Spider-Men as you explore an expanded Marvel’s New York. Fight against a variety of new and iconic villains, including an original take on the monstrous Venom, the ruthless Kraven the Hunter, the volatile Lizard and many more. Explore a larger Marvel’s New York than ever before, featuring two new boroughs – Brooklyn and Queens – as well as locations like Coney Island and more.","Insomniac Games","Sony Interactive Entertainment","PlayStation 5, PC","Open-World Action"
"The Legend of Zelda: The Wind Waker HD","https://www.metacritic.com/game/the-legend-of-zelda-the-wind-waker-hd/","90",2013-09-20,"As the purported definitive version of the game, The Legend of Zelda: The Wind Waker HD is remastered and presented in 1080p graphics. Gamers can experience high-definition cell-shaded presentation on their TVs or entirely on the Wii U GamePad controller. The streamlined interface lets gamers easily manage your inventory—simply slide an item onto any button. Instantly view maps and zoom in on the GamePad controller's touch screen. Enjoy a breezy cruise with the original sail, or switch to the brand-new Swift Sail that lets you gather the wind and speed across the waves. With the new Tingle Bottle feature, you can connect with others over Miiverse. Comments or screenshots others have posted on Miiverse may wash up on the shore or appear in other locations, tucked into bottles. Whenever you want, move around the world in first-person mode, using the GamePad gyroscope to look around you and aim your bow, hookshot, Picto Box, or telescope. You can store more pictographs with your improved Picto Box—handy for creating figurines—and share them with other players on Miiverse. Your pictures, game tips, and messages may also appear in another player's game. Take the adventure to new levels with Hero Mode, available from the moment you start the game. In this mode, you only regain health when you earn a new heart piece or container, use a red potion, or visit a fairy fountain. Also, your enemies do double the damage. [Nintendo]","HexaDrive","Nintendo","Wii U","Open-World Action"
"Portal","https://www.metacritic.com/game/portal/","90",2007-10-10,"Portal is a new single player game from Valve. Set in the mysterious Aperture Science Laboratories, Portal has been called one of the most innovative new games on the horizon and offers gamers hours of unique gameplay. The game is designed to change the way players approach, manipulate, and surmise the possibilities in a given environment; similar to how Half-Life 2's Gravity Gun innovated new ways to leverage an object in any given situation. Players must solve physical puzzles and challenges by opening portals to maneuvering objects, and themselves, through space. [Valve]","Valve Software","Valve Software","PC","FPS"
"The Legend of Zelda: Phantom Hourglass","https://www.metacritic.com/game/the-legend-of-zelda-phantom-hourglass/","90",2007-10-01,"[Metacritic's 2007 DS Game of the Year]  Many months have passed since the events of The Legend of Zelda: The Wind Waker, and Link, Tetra and Tetra’s band of pirates have set sail in search of new lands. They come across a patch of ocean covered in a dense fog, in which they discover an abandoned ship. Tetra falls into danger when she explores the ship alone, and Link falls into the ocean when he attempts to rescue her. When he washes up unconscious on the shores of a mysterious island, he is awakened by the sound of a fairy’s voice. With the aid of this fairy, he sets off to find Tetra – and his way back to the seas he once knew. The stylus makes controlling Link easier than ever. Tap on the screen to make Link move, or sweep the stylus around him to swing the sword. Players can even draw a path for his boomerang and send it flying into hard-to-reach targets. Players can stash the map on the top screen for quick reference or drop it to the touch screen to make notes, study enemies, or chart a path for their boat to follow while they man the cannons. Compete with a friend over a local wireless connection: Guide Link through special dungeons to capture the Triforce or command the forces that oppose him. [Nintendo]","Nintendo","Nintendo","DS","Open-World Action"
"NHL 2001","https://www.metacritic.com/game/nhl-2001/","90",2000-09-28,"High-flyin', hard hittin', intense powerplay hockey is back with EA Sports' NHL 2001, bringing gamers out of the stands and onto the ice. Lace up the skates and play with or against all 30 National Hockey League teams, including the expansion Columbus Blue Jackets and Minnesota Wild.  [Electronic Arts]","EA Sports","EA Sports","PlayStation, PC, PlayStation 2","Hockey Sim"
"Jack Jeanne","https://www.metacritic.com/game/jack-jeanne/","90",2023-06-15,"The game's story centers around protagonist Kisa Tachibana, a girl who had given up on a career in theater, but receives an invitation to attend the Univeil Drama School, an elite drama school for male actors, where students play female roles (referred to as ""Jeanne"" roles) in addition to male roles (""Jack"" roles). 

However, to maintain her enrollment, she must land a starring role in the school's play at the end of the year and also hide that she is a girl.","Broccoli","Aksys Games","Nintendo Switch, iOS (iPhone/iPad)","Visual Novel"
"Dance Dance Revolution","https://www.metacritic.com/game/dance-dance-revolution/","90",2001-05-09,"Dance Dance Revolution is a great introduction to a truly unique series with incredibly addictive gameplay and a soundtrack that will have you humming for days.","Konami","Konami","PlayStation, PC","Dancing"
"Advance Wars: Dual Strike","https://www.metacritic.com/game/advance-wars-dual-strike/","90",2005-08-22,"Players lead their new Commanding Officers to fend off the Black Hole Army’s latest invasion. With massive battles that sweep across both of the DS screens, Advance Wars: Dual Strike will change the face of war forever. Use the top screen for quick-reference battle intel, or take control in battles that rage across both screens. Command a fleet of fighters high in the skies while troops clash with the enemy on the ground far below. New COs, new Tag-Team battles: Choose from new Commanding Officers, and combine their powers for incredible attacks that can turn the tide of battles. Real-time Combat mode: For a battle with a twist, players lead soldiers into a fast-paced, action-oriented battle against a storm of enemies. Easy-to-use map editor: Just grab a stylus and draw maps right on the touch screen, then send the maps to friends wirelessly. [Nintendo]","Intelligent Systems","Nintendo","DS","Turn-Based Tactics"
